{"activation":{"blockedByUnresolved":true,"eligible":false,"reason":"Blocked by 60 unresolved field(s) across 17 candidate(s); the compiler never activates runtime data.","requiresReview":true,"runtimeActivationAllowed":false},"bundleDigest":"sha256:1edc9b68343414a9a75c4293d97c7a62e18ed4071f44eeacc88dfdfe4cf1bd7e","bundleFormat":1,"bundleId":"BEN_MUA_CANDIDATES_V1","candidates":[{"candidateDigest":"sha256:eedb98be7394c4ec9924f205595d3a6f1a9dbc434ab38e9c8e6acf228d740693","candidateId":"QUEST-P00-01","definition":{"activation":"ACTIVE","graphId":"GRAPH_P00_01","levelBand":{"max":10,"min":1},"objectives":[{"count":3,"mapId":"MAP_BEN_MUA","objectiveId":"OBJ_P00_01_PACKAGES","targetIds":["OBJ_BM_PACKAGE_01","OBJ_BM_PACKAGE_02","OBJ_BM_PACKAGE_03"],"type":"COLLECT"}],"prerequisiteQuestIds":[],"questId":"P00-01","questType":"MAIN","rewards":{"currency":[{"amount":20,"currencyId":"COIN"}],"itemIds":["EQ-MK-CHEST-T1-R-COMMON"],"xpRule":"LEVEL_BAND_BASE"},"schemaVersion":1,"sourceRef":"Quest_and_Narrative_Production_Spec_vi.md#P00-01","startNpcId":"NPC_LYAN","titleKey":"QUEST.P00-01.TITLE","turnInNpcId":"NPC_TA_VAN_KHANH","unlocks":["P00-02"]},"fieldProvenance":[{"path":"/activation","sourceId":"QUEST_EXAMPLE_P00_01","sourceRef":"Implementation/Content/Examples/QuestDefinition/P00-01.json","sourceVersion":"v1","transform":"copy_canonical_example","units":"text"},{"path":"/graphId","sourceId":"QUEST_EXAMPLE_P00_01","sourceRef":"Implementation/Content/Examples/QuestDefinition/P00-01.json","sourceVersion":"v1","transform":"copy_canonical_example","units":"id"},{"path":"/levelBand/max","sourceId":"QUEST_EXAMPLE_P00_01","sourceRef":"Implementation/Content/Examples/QuestDefinition/P00-01.json","sourceVersion":"v1","transform":"copy_canonical_example","units":"level"},{"path":"/levelBand/min","sourceId":"QUEST_EXAMPLE_P00_01","sourceRef":"Implementation/Content/Examples/QuestDefinition/P00-01.json","sourceVersion":"v1","transform":"copy_canonical_example","units":"level"},{"path":"/objectives/0/count","sourceId":"QUEST_EXAMPLE_P00_01","sourceRef":"Implementation/Content/Examples/QuestDefinition/P00-01.json","sourceVersion":"v1","transform":"copy_canonical_example","units":"count"},{"path":"/objectives/0/mapId","sourceId":"QUEST_EXAMPLE_P00_01","sourceRef":"Implementation/Content/Examples/QuestDefinition/P00-01.json","sourceVersion":"v1","transform":"copy_canonical_example","units":"id"},{"path":"/objectives/0/objectiveId","sourceId":"QUEST_EXAMPLE_P00_01","sourceRef":"Implementation/Content/Examples/QuestDefinition/P00-01.json","sourceVersion":"v1","transform":"copy_canonical_example","units":"id"},{"path":"/objectives/0/targetIds/0","sourceId":"QUEST_EXAMPLE_P00_01","sourceRef":"Implementation/Content/Examples/QuestDefinition/P00-01.json","sourceVersion":"v1","transform":"copy_canonical_example","units":"id"},{"path":"/objectives/0/targetIds/1","sourceId":"QUEST_EXAMPLE_P00_01","sourceRef":"Implementation/Content/Examples/QuestDefinition/P00-01.json","sourceVersion":"v1","transform":"copy_canonical_example","units":"id"},{"path":"/objectives/0/targetIds/2","sourceId":"QUEST_EXAMPLE_P00_01","sourceRef":"Implementation/Content/Examples/QuestDefinition/P00-01.json","sourceVersion":"v1","transform":"copy_canonical_example","units":"id"},{"path":"/objectives/0/type","sourceId":"QUEST_EXAMPLE_P00_01","sourceRef":"Implementation/Content/Examples/QuestDefinition/P00-01.json","sourceVersion":"v1","transform":"copy_canonical_example","units":"enum"},{"path":"/prerequisiteQuestIds","sourceId":"QUEST_EXAMPLE_P00_01","sourceRef":"Implementation/Content/Examples/QuestDefinition/P00-01.json","sourceVersion":"v1","transform":"copy_canonical_example","units":"list"},{"path":"/questId","sourceId":"QUEST_EXAMPLE_P00_01","sourceRef":"Implementation/Content/Examples/QuestDefinition/P00-01.json","sourceVersion":"v1","transform":"copy_canonical_example","units":"id"},{"path":"/questType","sourceId":"QUEST_EXAMPLE_P00_01","sourceRef":"Implementation/Content/Examples/QuestDefinition/P00-01.json","sourceVersion":"v1","transform":"copy_canonical_example","units":"enum"},{"path":"/rewards/currency/0/amount","sourceId":"QUEST_EXAMPLE_P00_01","sourceRef":"Implementation/Content/Examples/QuestDefinition/P00-01.json","sourceVersion":"v1","transform":"copy_canonical_example","units":"currency_units"},{"path":"/rewards/currency/0/currencyId","sourceId":"QUEST_EXAMPLE_P00_01","sourceRef":"Implementation/Content/Examples/QuestDefinition/P00-01.json","sourceVersion":"v1","transform":"copy_canonical_example","units":"id"},{"path":"/rewards/itemIds/0","sourceId":"QUEST_EXAMPLE_P00_01","sourceRef":"Implementation/Content/Examples/QuestDefinition/P00-01.json","sourceVersion":"v1","transform":"copy_canonical_example","units":"id"},{"path":"/rewards/xpRule","sourceId":"QUEST_EXAMPLE_P00_01","sourceRef":"Implementation/Content/Examples/QuestDefinition/P00-01.json","sourceVersion":"v1","transform":"copy_canonical_example","units":"rule_token"},{"path":"/schemaVersion","sourceId":"QUEST_EXAMPLE_P00_01","sourceRef":"Implementation/Content/Examples/QuestDefinition/P00-01.json","sourceVersion":"v1","transform":"copy_canonical_example","units":"schema_version"},{"path":"/sourceRef","sourceId":"QUEST_EXAMPLE_P00_01","sourceRef":"Implementation/Content/Examples/QuestDefinition/P00-01.json","sourceVersion":"v1","transform":"copy_canonical_example","units":"source_reference"},{"path":"/startNpcId","sourceId":"QUEST_EXAMPLE_P00_01","sourceRef":"Implementation/Content/Examples/QuestDefinition/P00-01.json","sourceVersion":"v1","transform":"copy_canonical_example","units":"id"},{"path":"/titleKey","sourceId":"QUEST_EXAMPLE_P00_01","sourceRef":"Implementation/Content/Examples/QuestDefinition/P00-01.json","sourceVersion":"v1","transform":"copy_canonical_example","units":"localization_key"},{"path":"/turnInNpcId","sourceId":"QUEST_EXAMPLE_P00_01","sourceRef":"Implementation/Content/Examples/QuestDefinition/P00-01.json","sourceVersion":"v1","transform":"copy_canonical_example","units":"id"},{"path":"/unlocks/0","sourceId":"QUEST_EXAMPLE_P00_01","sourceRef":"Implementation/Content/Examples/QuestDefinition/P00-01.json","sourceVersion":"v1","transform":"copy_canonical_example","units":"id"}],"kind":"QUEST","status":"READY_FOR_REVIEW","targetId":"P00-01","targetSchema":"Implementation/Content/Schemas/QuestDefinition.schema.json","unresolved":[]},{"candidateDigest":"sha256:f709e1f6c461e6ba16cee5aa4e6b2130a5bf58b85c638abe5b8543a20e4557b7","candidateId":"QUEST-P00-02","definition":{"graphId":"GRAPH_P00_02","levelBand":{"max":10,"min":1},"objectives":[{"count":3,"mapId":"MAP_BEN_MUA","objectiveId":"OBJ_P00_02_RIPPLES","targetIds":["OBJ_BM_WATER_RIPPLE_01","OBJ_BM_WATER_RIPPLE_02","OBJ_BM_WATER_RIPPLE_03"],"type":"INTERACT"},{"count":4,"mapId":"MAP_BEN_MUA","objectiveId":"OBJ_P00_02_CARPLING","targetIds":["MOB_CARPLING"],"type":"KILL"},{"count":1,"mapId":"MAP_BEN_MUA","objectiveId":"OBJ_P00_02_REPORT","targetIds":["NPC_TA_VAN_KHANH"],"type":"TALK"}],"prerequisiteQuestIds":["P00-01"],"questId":"P00-02","questType":"MAIN","schemaVersion":1,"sourceRef":"Quest_and_Narrative_Production_Spec_vi.md#P00-02","startNpcId":"NPC_TA_VAN_KHANH","titleKey":"QUEST.P00-02.TITLE","turnInNpcId":"NPC_TA_VAN_KHANH"},"fieldProvenance":[{"path":"/graphId","sourceId":"QUEST_DIALOGUE","sourceRef":"docs/production/Quest_Dialogue_Production_Data_vi.csv#P00-02","sourceVersion":"v1-VI_EDITED_P1","transform":"verbatim","units":"id"},{"path":"/levelBand/max","sourceId":"MAP_EXAMPLE_BEN_MUA","sourceRef":"Implementation/Content/Examples/MapDefinition/MAP_BEN_MUA.json#/levelBand","sourceVersion":"v1","transform":"verbatim","units":"level"},{"path":"/levelBand/min","sourceId":"MAP_EXAMPLE_BEN_MUA","sourceRef":"Implementation/Content/Examples/MapDefinition/MAP_BEN_MUA.json#/levelBand","sourceVersion":"v1","transform":"verbatim","units":"level"},{"path":"/objectives/0/count","sourceId":"QUEST_SPEC","sourceRef":"docs/production/Quest_and_Narrative_Production_Spec_vi.md#P00-02","sourceVersion":"v1","transform":"verbatim","units":"count"},{"path":"/objectives/0/mapId","sourceId":"MAP_ATLAS","sourceRef":"docs/production/Map_Production_Atlas_vi.md#Map-01-Ben-Mua","sourceVersion":"v1.0","transform":"verbatim","units":"id"},{"path":"/objectives/0/objectiveId","sourceId":"QUEST_SPEC","sourceRef":"docs/production/Quest_and_Narrative_Production_Spec_vi.md#P00-02","sourceVersion":"v1","transform":"proposed_stable_id","units":"id"},{"path":"/objectives/0/targetIds/0","sourceId":"MAP_ATLAS","sourceRef":"docs/production/Map_Production_Atlas_vi.md#Map-01-Ben-Mua","sourceVersion":"v1.0","transform":"transcribed","units":"id"},{"path":"/objectives/0/targetIds/1","sourceId":"MAP_ATLAS","sourceRef":"docs/production/Map_Production_Atlas_vi.md#Map-01-Ben-Mua","sourceVersion":"v1.0","transform":"transcribed","units":"id"},{"path":"/objectives/0/targetIds/2","sourceId":"MAP_ATLAS","sourceRef":"docs/production/Map_Production_Atlas_vi.md#Map-01-Ben-Mua","sourceVersion":"v1.0","transform":"transcribed","units":"id"},{"path":"/objectives/0/type","sourceId":"QUEST_SPEC","sourceRef":"docs/production/Quest_and_Narrative_Production_Spec_vi.md#P00-02","sourceVersion":"v1","transform":"mapped_to_schema_enum","units":"enum"},{"path":"/objectives/1/count","sourceId":"QUEST_SPEC","sourceRef":"docs/production/Quest_and_Narrative_Production_Spec_vi.md#P00-02","sourceVersion":"v1","transform":"verbatim","units":"count"},{"path":"/objectives/1/mapId","sourceId":"MAP_ATLAS","sourceRef":"docs/production/Map_Production_Atlas_vi.md#Map-01-Ben-Mua","sourceVersion":"v1.0","transform":"verbatim","units":"id"},{"path":"/objectives/1/objectiveId","sourceId":"QUEST_SPEC","sourceRef":"docs/production/Quest_and_Narrative_Production_Spec_vi.md#P00-02","sourceVersion":"v1","transform":"proposed_stable_id","units":"id"},{"path":"/objectives/1/targetIds/0","sourceId":"QUEST_SPEC","sourceRef":"docs/production/Quest_and_Narrative_Production_Spec_vi.md#P00-02","sourceVersion":"v1","transf